<?xml version="1.0" encoding="UTF-8"?>
<!DOCTYPE plugin SYSTEM "dtd/action.dtd">
<plugin>
  <action>new</action>
  <name>ECHO2</name>
  <version>1</version>
  <type>com.jmstoolkit.pipeline.plugin.Echo</type>
  <!-- the configuration for the plugin goes in the work tag -->
  <work>
  <![CDATA[ 
  ]]>
  </work>
  <destinations>
    <input>dynamicTopics/PL2.INPUT</input>
    <output>dynamicTopics/PL2.OUTPUT</output>
    <replyto>dynamicTopics/PL.REPLYTO</replyto>
  </destinations>
</plugin>
